template_key,descripcion,contenido,pdf_url,descripcion_old
NACIONALIDAD POR APELLIDOS,Aplica a consultas sobre la vía de nacionalidad vinculada a apellidos (sólo cuando exista base legal vigente/reciente). Usar con cautela; normalmente orientar a vías estándar. NO usar si se refiere a LMD u opción por filiación.,"Hola!

Gracias por escribir.

En la actualidad, NO existe la posibilidad de solicitar nacionalidad española por apellido. Aunque hasta el 2019 esto fue, más o menos, posible. Sin embargo,  desde el 1 de octubre de 2019 está vía ya no está disponible.

Te explico un poco!	

Como sabéis durante varios siglos la comunidad judía desplazada de Israel se asentó en la Península Ibérica. Estos judíos nacieron, crecieron y se educaron aquí. A estos judíos se les denomina SEFARDÍES.

Sin embargo, en 1492 los reyes Católicos expulsan de la península a todos aquellos judíos que no se convirtieron al catolicismo. Y así, una gran parte de estos judíos se van de España y se asientan por diferentes territorios del mundo. A pesar de que estos judíos son expulsados de España no dejaban de ser originariamente españoles.

Por eso, en el año 2015, se aprueba una ley que pretendía reparar a este colectivo y permite que todos aquellos que prueben ser descendientes de estos judíos sefardíes, podrían obtener su nacionalidad española sin necesidad de residir en España y a través de un procedimiento electrónico.

Una de las formas de acreditar esta descendencia era a través de los apellidos, de forma que durante estos años se publican infinidad de listas de apellidos de origen sefardí y, tener uno de esos apellidos, podía significar ser descendiente.

Sin embargo, tener un simple apellido no era suficiente, sino que había que acreditar mediante informe de comunidades judías o rabínicas reconocidas que, efectivamente, cumplías la condición de descendiente.

Y pasó que se solicitaron cerca de 200 mil nacionalidades por esta vía.

Sin embargo, esta posibilidad solo estuvo vigente hasta octubre de 2019, momento en el que finaliza la ley y, por tanto, se suprime la posibilidad de solicitar nacionalidad por apellidos.

Todos los expedientes que se presentaron antes de esa fecha y aún no han sido resueltos, seguro serán resueltos con el tiempo, pero NO se pueden presentar nuevas solicitudes.

Siento haberte hecho la historia tan larga, pero es importante conocerla para que entendáis el motivo de por qué mucha gente pudo obtenerla y para acercarte, un poquito más, a la historia de España.

Abrazo grande,

Sai.",,"La gente cree que por tener un apellido de origen español, como Sánchez, ya puede tramitar nacionalidad"
RECURSO CONTENCIOSO,"Aplica a personas con expediente de nacionalidad EXCESIVAMENTE demorado o denegado que desean interponer recurso contencioso-administrativo. Requiere: nº expediente, fechas y estado actual. NO usar para simples consultas de inicio.","Hola!

Gracias por escribir :)
Cuando ya habéis cumplido el año de espera desde que solicitasteis nacionalidad española por residencia tenéis tres opciones: seguir esperando, interponer un recurso administrativo o interpone un recurso contencioso administrativo.

La realidad es que el recurso administrativo a nosotros no nos ha funcionado nunca, pero eso no significa que no vaya a funcionar en vuestro caso!
Yo en este mail te explico el recurso contencioso que es el recurso que verdaderamente funciona.

-----------------------------------------------------

En virtud del reglamento que regula el acceso a la nacionalidad española por residencia, el Ministerio de Justicia tiene un año para resolver sobre la misma.

Una vez pasado dicho plazo, en virtud de la citada Ley, la nacionalidad debe entenderse DENEGADA.

Esto no quiere decir que si pasan los 12 meses desde la presentación vayas a obtener una respuesta negativa en cuanto a tu solicitud, simplemente es un plazo que la Ley establece para que los ciudadanos puedan interponer un recurso.

Ahora sí! Te cuento todo!	

¿QUÉ ES EL RECURSO CONTENCIOSO?
El recurso contencioso en un recurso que se presenta directamente ante la Audiencia Nacional  y requiere de los servicios de abogado y procurador (siendo un trámite que NO puede presentar el solicitante por sí mismo, dado que se trata de un recurso judicial).

Se trata de un recurso JUDICIAL que se interpone ante la Audiencia Nacional donde se solicita que la misma exija al Ministerio que cumpla con su obligación de resolver.

Al ser un recurso judicial (y no administrativo) siempre será necesario contar con abogado y procurador, no siendo posible presentarlo el particular por sí mismo.

REQUISITOS:

- Haber presentado el expediente de nacionalidad española por residencia después de octubre del año 2015, que es cuando entró en vigor el procedimiento telemático de la misma.

- Que haya transcurrido UN AÑO desde su solicitud. No pudiendo presentarse ni un solo día antes.

- Qué se haya presentado con toda la documentación, sin ningún tipo de error. Si algún documento se presentó caducado o erróneamente en el recurso podremos presentar dichos documentos, pero lo ideal es que el expediente esté perfectamente presentado para que salga con el recurso.

PLAZOS

Aunque no hay un tiempo límite para su resolución, aproximadamente en un plazo de 6 meses la nacionalidad recurrida suele ser aprobada.

DOCUMENTOS:

Vamos a necesitar TODOS los documentos que se presentaron en la solicitud inicial, incluido el pasaporte actual si el mismo se ha renovado desde que se solicitó la nacionalidad española y el justificante de presentación del expediente.

Los documentos deben estar Perfectamente digitalizados, no siendo válidas las fotografías.

PODER NOTARIAL:

Dado que este proceso es judicial, necesitamos que el solicitante nos realice un PODER para poder presentar el recurso en vuestro nombre.

Este poder podrá realizarse de forma digital en el caso de que el recurrente sea titular de un certificado digital a través de la web del Ministerio.

Si el recurrente no tiene certificado digital, tendrá que acudir a un notario y realizar dicho poder de forma presencial a favor del procurador (los datos los facilitamos al momento de contratar).

PRECIO:

El precio del recurso son 600€+IVA (726€) e incluye: honorarios de ambos profesionales, tasa y todo el procedimiento completo.

El 50% del precio (300€ + IVA) debe pagarse al iniciar el trámite, momento en el cual se comienza con la revisión, redacción del recurso y su presentación por parte del procurador.

El 50% restante (300€+IVA), se abona cuando el recurso queda presentado.

Si quieres realizar este trámite con nosotros no dudes responder a este correo y comenzamos! Te compartiré una carpeta en Google Drive para que subas todos los documentos y, a partir de ahí, te derivaré al mail de nacionalidades para que podamos comenzar a redactar tu recurso.

Un saludo.",,"(cuando una persona ha solicitado nacionalidad española por residencia, si en un año no ha salido favorable puede interponer un recurso contencioso para que se resuelva lo antes posible"
RESIDIR MIENTRAS ESPERAMOS LMD,Aplica a descendientes que están TRAMITANDO o a la espera de resolución por LMD y preguntan cómo RESIDIR mientras tanto. Requiere: vínculo por LMD en curso. NO usar para iniciar LMD ni para familiar UE estándar.,"Hola!!!

Gracias por escribir.

Lamentablemente en España, a diferencia de lo que ocurre en Italia, no existe ninguna autorización de residencia que te permita vivir en España mientras te encuentras en trámite de tu nacionalidad española, de forma que, como el resto de extranjeros, podrás estar en España hasta un máximo de 90 días (como turista).

Hasta que no salga tu nacionalidad seguirás siendo extranjera.

Cosa distinta es que tramites otro tipo de autorización y permanezcas aquí hasta que seas español y, una vez tengas el acta, tramites desde España el DNI y pasaporte español.

Un saludo!!

Sai.",,"este mail es para aquellas personas que han presentado su nacionalidad por LMD u otro tipo en el consulado o desde España y quieren saber si mientras esperan pueden quedarse en España esperando, como ocurre en Italia, donde les dan un permiso de residencia y trabajo a esperas de su nacionalidad"
BÚSQUEDA DE ACTAS,Aplica a quienes necesitan ayuda para localizar actas/partidas en España o exterior para LMD/nacionalidad. Requiere: datos básicos de la persona/registro. NO usar para trámites migratorios sin necesidad documental.,"Hola,

Gracias por escribir.

Lamentablemente nosotros no prestamos el servicio de búsqueda de actas en España.

Si tienes todos los datos (nombre completo, fecha de nacimiento, lugar de nacimiento, nombre de los padres, etc.) te recomiendo que intentes pedirla tú mismo a través de la Sede del Ministerio de Justicia que, últimamente, está funcionando muy bien.

Aquí te copio el link: https://www.mjusticia.gob.es/es/ciudadania/tramites/certificadocertificacion (si lo que necesitas es un acta de nacimiento).

Aquí te copio el link: https://sede.mjusticia.gob.es/tramites/certificado-matrimonio (si lo que necesitas es un acta de matrimonio).

Si no tienes certificado digital marca la opción de Tramitación On line sin Cl@ve.

En caso de no contar con los datos y no poder acceder a ella de esta forma, tendrás que contar con los servicios de un genealogista.

Mi consejo es que si buscas un gestor o genealogista que te las busque, procures que sea uno que resida cerca del lugar de nacimiento, matrimonio o defunción de la persona en común, pues le será más fácil presentarse de forma personal en el Registro y, además, será mucho más barato.

Te mando un abrazo.

Sai.",,Esta respuesta es para aquellos que quieren tramitar su nacionalidad española desde el consulado pero les faltan actas de sus abuelos o bisabuelos y quieren saber si nosotros las buscamos
LEY DE MEMORIA DEMOCRÁTICA (LMD),"Aplica a nietos/bisnietos de españoles u otros supuestos de LMD que consultan sobre requisitos y documentación. Requiere: línea familiar viable y actas. NO usar para nacionalidad por residencia, matrimonio o CUE.","Hola!

Gracias por escribir.

Lamentablemente nosotros NO podemos presentar dichos expedientes pues es personal para los solicitantes, por ello, y dada nuestra imposibilidad para presentar dichos expedientes, hemos creado una GUÍA COMPLETA   sobre la NUEVA LEY DE MEMORIA DEMOCRÁTICA donde os explicamos los diferentes supuestos recogidos en la Ley, los documentos necesarios en cada uno de ellos y los lugares de presentación.

De momento es toda la información que tenemos. Pero os invitamos a seguir nuestras redes sociales donde damos muchísima información sobre este trámite y contamos de primera mano todas las novedades.

En todo caso, esta posibilidad se agota en octubre de 2025, así que salvo que ya hayas conseguido la cita o la consigas antes de que caduque la Ley, ya no podrás tramitarla!

Te mando un abrazo.

Sai.",https://drive.google.com/file/d/1oQj01ozEyQjwc0hjDjbKB5vCvGegRROp/view?usp=drive_link,Esta respuesta es para aquellos que quieren tramitar su nacionalidad española por LEY DE MEMORIA DEMOCRÁTICA.
PRIMER PAGO NACIONALIDAD (UN EXPEDIENTE),Aplica a clientes que contratan la presentación de UN expediente de nacionalidad y piden instrucciones de pago. Requiere: presupuesto aceptado. NO usar para varios expedientes.,"Hola!

Perfecto :)

Te cuento como funcionamos con los pagos de nacionalidad.

El precio es de 400€+IVA (484€) + 104,05€ de la tasa.

El primer pago es del 50% del trámite (242€) + la tasa en su totalidad (104,05€), es decir, de 346,05€. Si habéis tenido consulta hace menos de 3 meses con nosotros esos 50€ de consulta se descuentan de esta primera parte del pago.

El segundo pago sería del otro 50% del trámite (242€) y se abonaría cuando el expediente quede presentado.

Si se realizan dos o mas expedientes de forma conjunta (o dentro de un período de 30 días – no mas-) para el segundo y siguientes expedientes hay un descuento del 10%, es decir, el primero se abonaría en su totalidad y los siguientes se abonarían con el descuento.

Por tanto, el segundo y siguientes expedientes tendrían un precio de 360€ + IVA (435,60€) + la tasa de 104,05€.

Una vez se realiza el primer pago te remitimos directamente al mail de nacionalidad desde el cuál nos encargaremos de todo tu expediente!!

Abrazo grande.

Sai.

------------------------

Te mando los datos para el pago :)

-	Bizum: al número 640105301
-	Transferencia a La Caixa: IBAN: ES47 2100 4497 5101 0052 6767
-	Wise: BE71 9679 8896 4169 (10% de descuento)

Importante, en la casilla Concepto o Concepto de la transferencia, rellenar con tu nombre completo.

Por favor, cuando se realice el pago no olvides mandarnos el justificante a través de este mismo correo electrónico.

Un saludo.

Sai.

PRIMER PAGO NACIONALIDAD (VARIOS EXPEDIENTES)

Hola!

Perfecto :)

Aquí te explico los precios de la nacionalidad cuando son varios expedientes los que se presentan, vale?

El primer trámite se paga íntegro y los demás tienen un 20% de descuento (siempre que todos los expedientes se presenten dentro del mismo mes) por tanto sería así:

Precio      IVA        Tasa         Total
Primer trámite:         400         84,00     104,05     588,05
Segundo trámite       360         75,60     104,05     539,65
Tercer trámite           360         75,60     104,05     539,65
Cuarto trámite           360         75,60     104,05     539,65
----------------------------------------------------------------------------

El primer pago siempre es del 50% de los trámites (IVA incluído) + las tasas en su totalidad.

Una vez se realiza el 50% del pago de todos los trámites + las tasas correspondientes, te remito directamente al mail de nacionalidades desde el cual mi compañera Julia se encargará de armar completa la carpeta y responder todas las dudas y, una vez la carpeta esté completa será Sai quién se encargue de revisarla y presentarla ante el Colegio de Abogados.

Dicho esto, si quieres realizar el trámite con nosotros te comparto los datos para el pago!

Si tienes dudas del pago exacto, responde a este mail con el número de trámites y te desgloso el precio total sin problema 😊

-	Transferencia a La Caixa: IBAN: ES47 2100 4497 5101 0052 6767
-	Bizum: al número 640105301
-	Wise: BE71 9679 8896 4169 (10% de descuento)

Importante, en la casilla Concepto o Concepto de la transferencia, rellenar con tu nombre completo.

Por favor, cuando se realice el pago no olvides mandarnos el justificante a través de este mismo correo electrónico.

Un saludo!",,"Esta respuesta es para los que ya quieren avanzar con el trámite de nacionalidad española por residencia, para que puedan ya abonar el 50% del trámite. El precio varía dependiendo de si es una, dos o mas personas, pues hay descuento por trámite adicional siempre que se presente dentro del mismo mes, por ello, hay diferentes templates dependiendo del número de trámites que se vayan a presentar"
PRIMER PAGO NACIONALIDAD (VARIOS EXPEDIENTES),Aplica a clientes que contratan VARIOS expedientes de nacionalidad y piden instrucciones de pago. Requiere: acuerdo de nº de expedientes e importes. NO usar para un solo expediente.,"Hola!

Perfecto :)

Aquí te explico los precios de la nacionalidad cuando son varios expedientes los que se presentan, vale?

El primer trámite se paga íntegro y los demás tienen un 20% de descuento (siempre que todos los expedientes se presenten dentro del mismo mes) por tanto sería así:

Precio      IVA        Tasa         Total
Primer trámite:         400         84,00     104,05     588,05
Segundo trámite       360         75,60     104,05     539,65
Tercer trámite           360         75,60     104,05     539,65
Cuarto trámite           360         75,60     104,05     539,65
----------------------------------------------------------------------------

El primer pago siempre es del 50% de los trámites (IVA incluído) + las tasas en su totalidad.

Una vez se realiza el 50% del pago de todos los trámites + las tasas correspondientes, te remito directamente al mail de nacionalidades desde el cual mi compañera Julia se encargará de armar completa la carpeta y responder todas las dudas y, una vez la carpeta esté completa será Sai quién se encargue de revisarla y presentarla ante el Colegio de Abogados.

Dicho esto, si quieres realizar el trámite con nosotros te comparto los datos para el pago!

Si tienes dudas del pago exacto, responde a este mail con el número de trámites y te desgloso el precio total sin problema 😊

-	Transferencia a La Caixa: IBAN: ES47 2100 4497 5101 0052 6767
-	Bizum: al número 640105301
-	Wise: BE71 9679 8896 4169 (10% de descuento)

Importante, en la casilla Concepto o Concepto de la transferencia, rellenar con tu nombre completo.

Por favor, cuando se realice el pago no olvides mandarnos el justificante a través de este mismo correo electrónico.

Un saludo!",,explico los precios de la nacionalidad cuando son varios expedientes los que se presentan
FAMILIARES DE CIUDADANOS CON NACIONALIDAD ESPAÑOLA,"Aplica a familiares de ciudadano/a ESPAÑOL/A (no otras nacionalidades UE) que buscan residencia (p.ej., tarjeta familiar de ciudadano de la UE o régimen general según caso). Requiere: prueba de vínculo y convivencia/medios. NO usar para familiar de ciudadano UE no español (usar 'FAMILIAR UE 2025').","Hola!

Gracias por escribir!
Con la última gran reforma del reglamento de extranjería esta residencia ha sido la creación más importante y es que, desde el 20 de mayo de 2025, aquellos que sean familiares de españoles ya no tendrán que tramitar la residencia de arraigo familiar (que ha quedado para los progenitores de comunitarios), sino la residencia de familiares de españoles (se llama así)
No obstante, los documentos, requisitos y efectos, son exactamente los mismos, solo ha cambiado la denominación.

En este mail te adjunto un pdf donde te explicamos cuáles son los requisitos, las formas de solicitud y como trabajamos nosotros!

Cualquier cosa que necesites no dudes escribir!

Abrazo.

Sai.",https://drive.google.com/file/d/1s7SDgGxC3AqYhiOJyL_UnrWgcqo3__St/view?usp=drive_link,"Esta ha sido la gran reforma del nuevo reglamento de extranjería y es que, desde el 20 de mayo de 2025 aquellos que sean familiares de españoles ya no tendrán que tramitar la residencia de arraigo familiar (que ha quedado para los progenitores de comunitarios), sino la residencia de familiares de españoles (se llama así)"
RESIDENCIA INDEPENDIENTE,"Aplica a titulares de tarjeta como familiar de ciudadano de la UE o reagrupados que buscan RESIDENCIA INDEPENDIENTE (p.ej., ruptura de vínculo, víctimas, etc.). Requiere: supuesto legal habilitante. NO usar para primera concesión.","Hola!

Gracias por escribir.

Cuando tienes una residencia de familiar de español tu residencia depende enteramente de ese ciudadano, es decir, dicha residencia te la concedieron precisamente por el vínculo que te une con el ciudadano español de forma que si ese vínculo se rompe tendrás que ver si puedes mantener el régimen de familiar de español o debes tramitar una residencia independiente.

Así, el nuevo reglamento establece lo siguiente:

-	CASOS DE RESIDENCIA INDEPENDIENTE: son aquellos casos en los que, a pesar de haber desaparecido el vínculo con el ciudadano español, el familiar podrá seguir manteniendo su residencia en España con la simple notificación del hecho sin necesidad de hacer un complejo trámite en extranjería (pero dicho trámite debe hacerlo igualmente).

Estos casos en los que se podrá mantener dicho régimen con la solicitud de una residencia independiente son:

•	Fallecimiento de la persona de nacionalidad española, siempre que
hayan residido en España antes del fallecimiento del titular del derecho. Las personas que hubieran obtenido la autorización de residencia temporal de familiares de personas con nacionalidad española tendrán la obligación de comunicar el fallecimiento a la oficina de extranjería donde residan en el plazo máximo de seis meses desde que se produzca y tramitar una residencia independiente 

•	El cese de la residencia efectiva en España de la persona con nacionalidad española, que habrá de ser comunicada en el plazo máximo de seis meses desde que se produzca, no supondrá la pérdida de la autorización de residencia de sus hijos ni del progenitor que tenga atribuida la custodia efectiva de éstos, con independencia de su nacionalidad, siempre que dichos hijos residan en España y se encuentren matriculados en un centro de enseñanza para cursar estudios, ello hasta la finalización de éstos.

•	En el caso de nulidad del vínculo matrimonial o divorcio, o de la cancelación de la inscripción como pareja registrada, de la persona con nacionalidad española con la persona extranjera, esta tendrá obligación de comunicar dicha circunstancia a las autoridades competentes en el plazo de seis meses desde que se produzca. Para conservar el derecho de residencia, deberá acreditarse: Que el matrimonio o pareja de hecho tuvo una duración de, al menos, 3 años (desde la constitución hasta el inicio del procedimiento judicial de nulidad del matrimonio, divorcio o de la cancelación de la inscripción como pareja registrada) y que UNO de esos años hubiera transcurrido en España (en este caso bastará la notificación a extranjería del hecho y no será necesario tramitar una residencia independiente).

•	Otorgamiento por mutuo acuerdo o decisión judicial, de la custodia de los hijos e hijas de la persona con nacionalidad española, al excónyuge o expareja registrada o estable de nacionalidad extranjera

•	Resolución judicial o mutuo acuerdo entre las partes que determine el derecho de visita, al hijo o hija menor, del excónyuge o expareja registrada o estable de nacionalidad extranjera, cuando dicho menor resida en España y dicha resolución o acuerdo se encuentre vigente.

•	Cuando la persona extranjera fuera víctima de violencia de género, de violencia sexual, etc.

Fuera de los casos anteriores, cuando no sea posible mantener la autorización a título personal, el familiar de español tendrá que tramitar una residencia de trabajo por cuenta ajena, cuenta propia o residencia no lucrativa, cumpliendo los requisitos para ello.

El plazo para poder solicitar la autorización independiente es de 6 meses desde que se produzca la causa que da derecho a solicitar una autorización independiente",,Este template es para los que tienen residencia por estar casado o en pareja de hecho con un ciudadano español y se divorcian o separan y quieren saber qué hacer ahora
PUEDO TRABAJAR CON LA RESIDENCIA EN TRÁMITE,Aplica a consultas sobre si se puede TRABAJAR con la renovación/modificación en TRÁMITE. Requiere: tipo de permiso y fase. NO usar para permisos iniciales sin resguardo habilitante.,"Hola!

Esta pregunta me la hacéis muchísimo así que voy a tratar de explicártelo lo mejor posible, vale? Y es que es sobre todo importante a la hora de buscar trabajo, porque los empleadores os piden la constancia de que, efectivamente, podéis trabajar mientras esperáis vuestra residencia.

Y es que, el 20 de mayo de 2025 se modifica el reglamento de extranjería y viene a modificar toda la regulación de la residencia de los familiares de españoles, entre otros muchos cambios.

En lo que se refiere a dichos familiares, el artículo 97.5 del mismo, establece lo siguiente:

""Salvo que se hayan inadmitido o denegado autorizaciones del mismo tipo con base en una identidad sustancial de hechos, la presentación de la solicitud otorgará, durante su tramitación y hasta su resolución, el derecho de permanecer provisionalmente a los familiares en España y, en el caso de aquellos referidos en las letras a), b), c) y d) del artículo 94, habilitará para el desarrollo de actividades laborales o profesionales por cuenta ajena o propia, respectivamente. El mantenimiento de la autorización provisional y, en su caso, de la habilitación para trabajar quedarán condicionados a la posterior concesión definitiva de la autorización, quedando sin efecto en otro caso"".

Los familiares a los que hace referencia dicho artículo se refieren a: a) cónyuge de ciudadano español, b) pareja de hecho de ciudadano español, c) paraje debidamente probada de ciudadano español y d) hijos menores de 26 años de un ciudadano español o de su cónyuge o pareja, así como los mayores de dicha edad que acrediten estar a cargo del mismo.

En el caso de que se refiera a otros familiares de español, por ejemplo, progenitores de menores españoles o ascendientes a cargo, así como los hijos de españoles de origen, NO podrán realizar actividad laboral o profesional hasta que se resuelva la solicitud, por lo tanto, como véis, no es un derecho absoluto para todos los familiares de españoles.

Igualmente, es un derecho bastante complejo de ejercitar pues no basta que la ley lo reconozca, si no que es necesario que las oficinas de extranjería emitan una resolución al respecto que contenga el NIE del familiar extranjero, pues por mucho reconocimiento legal si el ciudadano no consta con un NIE no podrá ser dado de alta en SS por ningún empleador, dado que el sistema no admite alta con pasaporte… Una vez mas, dependemos de las diferentes oficinas de extranjería.

Espero haberte ayudado con esta respuesta!

Un abrazo.

Sai.",,este template es para aquellas personas que acaban de meter la residencia de familiar de español y quieren saber si pueden trabajar durante el proceso
